{
  "run_id": "test-mode-premium-pass-run-002",
  "decision": "PASS",
  "scores": {
    "content": 90,
    "factual": 98,
    "visual": 90,
    "brand": 92,
    "social": 88,
    "novelty": 88
  },
  "critical_failures": [],
  "reasons": [],
  "required_changes": [],
  "visual_archetype": "visual metaphor",
  "previous_archetypes_checked": [
    "generic 3-row infographic",
    "visual metaphor",
    "generic 3-row infographic",
    "visual metaphor",
    "mechanism visualization"
  ],
  "template_repetition": false,
  "inspected_asset": "D:\\new orchestration\\pipeline\\state\\vanna_competitor_matched_post2.png",
  "timestamp": "2026-09-15T06:16:31.637309+00:00"
}